{
  "schema_version": "stage26-release-evidence-v1.0.0",
  "release_id": "REPLACE_ME",
  "git_sha": "f5f281ed52c30667d02e7a8d40d0cbba6d537791",
  "target_environment": "staging",
  "ci": {"status": "FAIL", "stage24": "FAIL", "stage25": "FAIL", "stage26": "FAIL"},
  "migrations": {"plan_version": "stage26-postgres-sequence-v1.1.0", "staging_dry_run": "FAIL", "applied": "NOT_RUN", "used_superseded_file": false},
  "backup": {"recovery_point_created": false, "recovery_point_id": "", "restore_drill_status": "NOT_RUN", "measured_rto_minutes": null},
  "providers": {"compute": "UNRESOLVED", "postgres": "UNRESOLVED", "backup": "UNRESOLVED", "secret_manager": "UNRESOLVED", "malware_scanner": "UNRESOLVED", "error_monitoring": "UNRESOLVED", "dns_tls": "UNRESOLVED", "alert_channel": "UNRESOLVED", "admin_mfa": "UNRESOLVED"},
  "security": {"https": "FAIL", "headers": "FAIL", "secret_scan": "FAIL"},
  "health": {"status": "FAIL", "database_connectivity": "FAIL"},
  "smoke": {"status": "FAIL", "frontend": "FAIL", "safe_api": "BLOCKED_BY_UPSTREAM_RUNTIME"},
  "monitoring": {"configured": false, "release_window_status": "NOT_OBSERVED", "rollback_threshold_breached": false},
  "rollback": {"available": false, "previous_revision_recorded": false},
  "release_note": "REPLACE_ME"
}
